{
  "schema_version": "1.0.0",
  "document_type": "review-candidate",
  "document_id": "review-candidate_cand_b2",
  "created_at": "2026-07-18T12:00:00Z",
  "workspace": "lab_demo",
  "source_id": "src_demo_02",
  "source_hash": {
    "algorithm": "sha256",
    "value": "2222222222222222222222222222222222222222222222222222222222222222"
  },
  "review_generation": 1,
  "producer": {
    "kind": "ENGINE",
    "name": "s9k-data-engine",
    "version": "0.3.0",
    "model": null
  },
  "provenance": {
    "source_id": "src_demo_02",
    "source_hash": {
      "algorithm": "sha256",
      "value": "2222222222222222222222222222222222222222222222222222222222222222"
    },
    "review_generation": 1,
    "pipeline_version": "0.3.0",
    "producer": {
      "kind": "ENGINE",
      "name": "s9k-data-engine",
      "version": "0.3.0",
      "model": null
    }
  },
  "candidate_id": "cand_b2",
  "segment_id": "seg_02",
  "candidate_kind": "ENTITY",
  "entity_type": "Character",
  "canonical_name": "Lugar Epsilon",
  "display_name": "Lugar Epsilon",
  "aliases": [],
  "description": "Entidad sintetica de laboratorio.",
  "attributes": {
    "faction": "Alfa"
  },
  "confidence": 0.5,
  "evidence": [
    {
      "evidence_id": "ev_cand_b2",
      "quote": "Lugar Epsilon aparece en el texto.",
      "location": {
        "kind": "PAGE_RANGE",
        "page_start": 1,
        "page_end": 2
      }
    }
  ],
  "source_location": {
    "kind": "PAGE_RANGE",
    "page_start": 1,
    "page_end": 2
  },
  "existing_matches": [
    {
      "entity_id": "ent_eps_1",
      "match_score": 0.58,
      "match_reason": "parcial"
    },
    {
      "entity_id": "ent_eps_2",
      "match_score": 0.57,
      "match_reason": "parcial"
    }
  ],
  "proposed_status": "CONFLICT",
  "policy_reasons": [
    "AMBIGUOUS_MATCH"
  ],
  "requires_review": true,
  "created_by": {
    "kind": "ENGINE",
    "name": "s9k-data-engine",
    "version": "0.3.0",
    "model": null
  }
}